{
  "format": "platter-theme/0",
  "id": "plastic-beach-white",
  "name": "Plastic Beach (White)",
  "canvas": {
    "width": 280,
    "height": 370
  },
  "attribution": {
    "author": "gabriela2400 (port of OtisBee's original CD Art Display skin)",
    "source_url": "",
    "license": "attribution-required",
    "original_app": "covergloobus",
    "upstream_author": null,
    "distribution": "free",
    "license_note": "skin.xml comment: \"this theme is free to distribute, mod and such as long as you accredit it back to =OtisBee (otisbee.deviantart.com) who made the artwork for CAD and ~gabriela2400 (gabriela2400.deviantart.com) who did the port for covergloobus\". Same basis as TrickLine."
  },
  "fonts": [
    {
      "family": "Bebas",
      "bundled": false,
      "reason": "named by the theme, never bundled with it"
    }
  ],
  "layers": [
    {
      "type": "image",
      "x": 82,
      "y": 82,
      "width": 170,
      "height": 170,
      "src": "nocover.png"
    },
    {
      "type": "artwork",
      "x": 82,
      "y": 82,
      "width": 170,
      "height": 170
    },
    {
      "type": "image",
      "x": 48,
      "y": 20,
      "width": 240,
      "height": 340,
      "src": "case.png"
    },
    {
      "type": "text",
      "x": 90,
      "y": 58,
      "width": 240,
      "bind": "artist",
      "font": {
        "family": "Bebas",
        "size": 7,
        "weight": "normal",
        "style": "normal"
      },
      "color": "#000000ff",
      "align": "left",
      "wrap": false,
      "overflow": {
        "mode": "scroll",
        "maxchars": 35
      }
    },
    {
      "type": "text",
      "x": 90,
      "y": 265,
      "width": 240,
      "bind": "album",
      "font": {
        "family": "Bebas",
        "size": 7,
        "weight": "normal",
        "style": "normal"
      },
      "color": "#000000ff",
      "align": "left",
      "wrap": false,
      "overflow": {
        "mode": "scroll",
        "maxchars": 35
      }
    },
    {
      "type": "text",
      "x": 90,
      "y": 278,
      "width": 240,
      "bind": "title",
      "font": {
        "family": "Bebas",
        "size": 7,
        "weight": "normal",
        "style": "normal"
      },
      "color": "#000000ff",
      "align": "left",
      "wrap": false,
      "overflow": {
        "mode": "scroll",
        "maxchars": 35
      }
    },
    {
      "type": "button",
      "x": 90,
      "y": 305,
      "action": "previous",
      "states": {
        "default": {
          "normal": "prev.png",
          "hover": null,
          "pressed": null
        }
      },
      "width": 10,
      "height": 10
    },
    {
      "type": "button",
      "x": 100,
      "y": 305,
      "action": "play_pause",
      "states": {
        "default": {
          "normal": "play.png",
          "hover": null,
          "pressed": null
        },
        "playing": {
          "normal": null,
          "hover": null,
          "pressed": null
        }
      },
      "width": 10,
      "height": 10
    },
    {
      "type": "button",
      "x": 110,
      "y": 305,
      "action": "next",
      "states": {
        "default": {
          "normal": "next.png",
          "hover": null,
          "pressed": null
        }
      },
      "width": 10,
      "height": 10
    }
  ]
}
