{
  "format": "platter-theme/0",
  "id": "snowcover-pro",
  "name": "SnowCover Pro",
  "canvas": {
    "width": 300,
    "height": 300
  },
  "attribution": {
    "author": "leonardomdq",
    "source_url": "https://www.deviantart.com/leonardomdq/art/SnowCover-Pro-for-Covergloobus-162264528",
    "license": "attribution-required",
    "original_app": "covergloobus",
    "upstream_author": null,
    "distribution": "free",
    "license_note": "Stated on the deviation page: \"If you use this skin, please give some credit!\" Read from the DeviantArt RSS description 2026-09-27. Same basis as TrickLine (\"If use please credit\")."
  },
  "fonts": [
    {
      "family": "Miso",
      "bundled": false,
      "reason": "miso-bold.ttf ships with the theme, but whether it may be redistributed is unresolved"
    }
  ],
  "layers": [
    {
      "type": "image",
      "x": 29,
      "y": 88,
      "width": 120,
      "height": 120,
      "src": "nocover.png"
    },
    {
      "type": "artwork",
      "x": 29,
      "y": 88,
      "width": 120,
      "height": 120
    },
    {
      "type": "image",
      "x": 28,
      "y": 88,
      "width": 121,
      "height": 121,
      "src": "case.png"
    },
    {
      "type": "image",
      "x": 0,
      "y": 10,
      "width": 179,
      "height": 74,
      "src": "panel.png"
    },
    {
      "type": "text",
      "x": 0,
      "y": 20,
      "width": 180,
      "bind": "title",
      "font": {
        "family": "Miso",
        "size": 11,
        "weight": "bold",
        "style": "normal"
      },
      "color": "#ffffffff",
      "shadow": {
        "color": "#000000ff",
        "dx": 1,
        "dy": 1
      },
      "align": "center",
      "wrap": false,
      "overflow": {
        "mode": "clip",
        "maxchars": 30
      }
    },
    {
      "type": "text",
      "x": 0,
      "y": 37,
      "width": 180,
      "bind": "artist",
      "font": {
        "family": "Miso",
        "size": 10,
        "weight": "normal",
        "style": "normal"
      },
      "color": "#ffffffff",
      "shadow": {
        "color": "#000000ff",
        "dx": 1,
        "dy": 1
      },
      "align": "center",
      "wrap": false,
      "overflow": {
        "mode": "clip",
        "maxchars": 21
      }
    },
    {
      "type": "rating",
      "x": 63,
      "y": 55,
      "width": 10,
      "height": 10,
      "star": "star.png",
      "empty": "nostar.png",
      "spacing": 1,
      "direction": "horizontal"
    }
  ]
}
