{
  "format": "platter-theme/0",
  "id": "last-fm-2",
  "name": "Last.fm 2",
  "canvas": {
    "width": 115,
    "height": 130
  },
  "attribution": {
    "author": "theconso (port of Clubberry's original CD Art Display skin)",
    "source_url": "https://www.deviantart.com/theconso/art/Last-fm2-for-Covegloobus-184787605",
    "license": "attribution-required",
    "original_app": "covergloobus",
    "upstream_author": null,
    "distribution": "free",
    "license_note": "Stated on the deviation page: \"If you use this skin, please give some credit!\" Read 2026-09-27. A port of Clubberry's CD Art Display skin, made with permission: skin.xml says \"Special thanks to Clubberry for give me the permission to port this skin\"."
  },
  "fonts": [],
  "layers": [
    {
      "type": "image",
      "x": 11,
      "y": 10,
      "width": 90,
      "height": 90,
      "src": "nocover.png"
    },
    {
      "type": "artwork",
      "x": 11,
      "y": 10,
      "width": 91,
      "height": 91
    },
    {
      "type": "image",
      "x": 0,
      "y": 0,
      "width": 115,
      "height": 115,
      "src": "case.png"
    },
    {
      "type": "button",
      "x": 25,
      "y": 110,
      "action": "previous",
      "states": {
        "default": {
          "normal": "nul.png",
          "hover": "prev.png",
          "pressed": null
        }
      },
      "width": 20,
      "height": 16
    },
    {
      "type": "button",
      "x": 47,
      "y": 110,
      "action": "play_pause",
      "states": {
        "default": {
          "normal": "nul.png",
          "hover": "play.png",
          "pressed": null
        },
        "playing": {
          "normal": "nul.png",
          "hover": "pause.png",
          "pressed": null
        }
      },
      "width": 20,
      "height": 16
    },
    {
      "type": "button",
      "x": 65,
      "y": 110,
      "action": "next",
      "states": {
        "default": {
          "normal": "nul.png",
          "hover": "next.png",
          "pressed": null
        }
      },
      "width": 20,
      "height": 16
    }
  ]
}
